{
  "schemaId": "xhs.m0.pr-assets.v1",
  "schemaVersion": 1,
  "baselineId": "xw-m0-20260817-r0",
  "capturedAt": "2026-08-17T12:58:16.409Z",
  "prArchiveRefsVerified": 10,
  "prs": [
    {
      "repo": "registry",
      "number": 7,
      "base": "e4660372a97a4197067d6298cbed1496a1035814",
      "mergeBase": "3e6be1c49314d543fa17e44bee4486c2eb518d1c",
      "head": "cfbf76186f7078420d75a34f25cd9eb21b7818c1",
      "tree": "dad4ac426190840de9b39a3afad7a5f52247b040",
      "commits": [
        "cfbf76186f7078420d75a34f25cd9eb21b7818c1",
        "ebbbfb434fcc3d80c78bcef724fbda982daeffff",
        "a85f1b1cbfaccb23a078a6f05db41f624e12b55c",
        "bb48c5f8e49c5dd0d16d6e538f678f10ef14f397",
        "1d1166c35ac9efa930ef4ccf38319e33bdd9eba2",
        "a1041448ed3ef471795d8d15b12a016feb766295",
        "fab4e49d909831cc90ec845d325eee6cf83ef2af",
        "e36c9a718bc1982c67de81cb701403a9c5a28aad",
        "95dd0be1349ffb401c6b7c3aa9240b37f406cda2",
        "ed1049970982a69ee763a3652d2b3825680e1b60",
        "a9260109d85a9e9d2ca921e41a9a82def2b2d811",
        "5cde432facc68cf27735cdf99327e4605514c944",
        "a8cd3138e67ac1e8e15490b83ac17b359d9c42d1",
        "4011bf4a47e7609e7710253ba79ad745d3aa878e",
        "d5f42047b664bf46b82a569eb6348d9b0e891996",
        "ac39c8000f524134f7da227f63848cd851d7a2de"
      ],
      "paths": [
        "HANDOFF-2026-08-08-foundation-pr4-gate.md",
        "PROGRESS.md",
        "docs/plans/2026-08-08-foundation-pr2-progress.md",
        "docs/plans/2026-08-08-foundation-pr2-wiring-closure.md",
        "docs/plans/2026-08-08-foundation-pr4-baseline.md",
        "docs/plans/2026-08-08-foundation-pr4-plan.md",
        "docs/plans/2026-08-08-foundation-pr4-progress.md",
        "docs/plans/2026-08-08-foundation-pr4-runbook.md",
        "docs/plans/2026-08-08-foundation-pr4.files.json",
        "docs/plans/2026-08-09-foundation-pr4-gate-b-activate-pilot-runbook.md"
      ],
      "diffstat": {
        "filesChanged": 10,
        "insertions": 1277,
        "deletions": 13
      },
      "stablePatchId": "b2c0848cf472c4497dca1c1189e7ec2436a4c79d",
      "refRestoreVerified": true,
      "portIssue": null
    },
    {
      "repo": "registry",
      "number": 9,
      "base": "e4660372a97a4197067d6298cbed1496a1035814",
      "mergeBase": "abad59426834d3e2dc4ee18936928c7bf4cb7b4e",
      "head": "8493ff00611f0aedb887eb4f20d8a1612da1bf89",
      "tree": "1c97be84b4cd05f81eb8a916c950461f3d218524",
      "commits": [
        "8493ff00611f0aedb887eb4f20d8a1612da1bf89",
        "7cd2c2605cc90b24a81cf29e1c223765ed0e7500",
        "1c24f0c74dbb9fce8f593b2fda1999d629545e91",
        "cb558b75c9655571c2b280ee535d76572990a336",
        "9a3984c51b3dc13cef6f64754fb1255ac710b96e",
        "b0775ee82f6d5264d0cd07acc1e5695ad8b43a8d",
        "d3a3559cbc18f5ed266da80d4de992ffe8aad928",
        "fb8e35b4d475a8965f531590e8b417d4649fbc78",
        "e9162b96d8e0d6784ff3f474ea59447f345d41e4",
        "a9b9b52b83a197541360dc748d5c0264119dd9d4",
        "9d7062505bb4bf0c4f8a144f6e05f6fd3d93d8e2",
        "b494f6ff6bf8307df0c5727816db3df2d167d17e",
        "0d619cb61720184c34854b23d11d022121d62263",
        "bd243da9f3ddb0d6dc8b3d9e5e80df920648cc74",
        "9a251c2825299e01929a62c0d832f078f4a97a7d",
        "77ac1e4a0a52897aa89a1dc8ed04c109417983c0",
        "000cf256b3af51c935345ae2f5299678b787e67d",
        "12d7f068dbf8a6422aa9e898932e70aa955fef06",
        "805da1cb6c8709361961029a0ef9311951572729",
        "c4d6bd8fd8d9cf45986aac04128804b8a5479e7d",
        "44a2fb17e1f574e06a428a7436b2de095fbd8b25",
        "84216a82f73c73903d4ca59f1e7d5521cb611f4b"
      ],
      "paths": [
        ".gitignore",
        "docs/handoffs/HANDOFF-2026-08-06-visual-tap-resolver-demo.md",
        "docs/plans/2026-08-06-visual-tap-resolver-demo-design.md",
        "experiments/visual-tap-resolver/.gitignore",
        "experiments/visual-tap-resolver/BASELINE.md",
        "experiments/visual-tap-resolver/README.md",
        "experiments/visual-tap-resolver/accept_benchmark.py",
        "experiments/visual-tap-resolver/ocr_integration.py",
        "experiments/visual-tap-resolver/requirements.txt",
        "experiments/visual-tap-resolver/resolver.py",
        "experiments/visual-tap-resolver/tests/test_accept_benchmark.py",
        "experiments/visual-tap-resolver/tests/test_resolver.py",
        "experiments/visual-tap-resolver/tests/test_vision_contract.py",
        "experiments/visual-tap-resolver/vision_contract.py",
        "experiments/visual-tap-resolver/visual_tap_demo.py"
      ],
      "diffstat": {
        "filesChanged": 15,
        "insertions": 4195,
        "deletions": 0
      },
      "stablePatchId": "0b0674b146387d14852e763ff0806cb16e08de3f",
      "refRestoreVerified": true,
      "portIssue": null
    },
    {
      "repo": "registry",
      "number": 10,
      "base": "e4660372a97a4197067d6298cbed1496a1035814",
      "mergeBase": "abad59426834d3e2dc4ee18936928c7bf4cb7b4e",
      "head": "349e01a62914ea54cd189a5443af0cd659db5d0c",
      "tree": "e4b983aa938f9a209ed5f7a0288e3aae169c2925",
      "commits": [
        "349e01a62914ea54cd189a5443af0cd659db5d0c",
        "67d13b0c2fc1e55fa066b6f0d5c435aece763cab",
        "caf3a1349d55b6def02d3765aeda46cc77912cb0",
        "fdddfdc1472246b7c79a76f46f2a5a195bd9c13c",
        "b5fbbd941ad04cf8f06838cda0d7282bded54c25"
      ],
      "paths": [
        "PROGRESS.md",
        "ops/_explore-lease.mjs",
        "ops/xw-mission.mjs",
        "ops/xw-skills.mjs",
        "registry.mjs",
        "scripts/lib/capability-runtime-eligibility.mjs",
        "scripts/lib/session-workflow-worker.mjs",
        "scripts/lib/task-orchestrator.mjs",
        "scripts/lib/typed-job-worker.mjs",
        "tests/capability-runtime-eligibility.test.mjs",
        "tests/registry.test.mjs",
        "tests/session-workflow-worker.test.mjs",
        "tests/task-orchestrator.test.mjs",
        "tests/typed-job-worker.test.mjs"
      ],
      "diffstat": {
        "filesChanged": 14,
        "insertions": 587,
        "deletions": 65
      },
      "stablePatchId": "4495995fa191d6a90763328b9f78854e8ad1cff5",
      "refRestoreVerified": true,
      "portIssue": null
    },
    {
      "repo": "registry",
      "number": 12,
      "base": "e4660372a97a4197067d6298cbed1496a1035814",
      "mergeBase": "63516bd4465f2e2595aeadbf63919ce67e575215",
      "head": "5cedb67454f5d2473a6b79e2cc7c415af9a79106",
      "tree": "a3128a931adbd457fc02298288a1918278aa12c3",
      "commits": [
        "5cedb67454f5d2473a6b79e2cc7c415af9a79106"
      ],
      "paths": [
        "PROGRESS.md",
        "ops/xw-explore-session.mjs",
        "ops/xw-start.mjs"
      ],
      "diffstat": {
        "filesChanged": 3,
        "insertions": 18,
        "deletions": 3
      },
      "stablePatchId": "efb148957d0e4e6727185f9c6d732b2f742201c5",
      "refRestoreVerified": true,
      "portIssue": null
    },
    {
      "repo": "deviceAgent",
      "number": 1,
      "base": "d52cd0799a362fbfadc78f43e7a2a2b549d53b48",
      "mergeBase": "72a7e04967e7fb6c6e418540c55dd5e9284b0e9a",
      "head": "8737575be101c3ab3f568730f774f0182738b7a3",
      "tree": "b6466446c6ab1ae712ea0b3469fe78eb7846544a",
      "commits": [
        "8737575be101c3ab3f568730f774f0182738b7a3",
        "0c4646471a36a8ea70c78ae844b9c057566f4c03",
        "e69cc6c14dc39a88c235d01b4b8ff61e82385ef3",
        "e5f3010043bb46ff087b5c7e4053ece5d29f26a8",
        "42d04a9fbdcd9b1dc051bcda161d574be0b33c94"
      ],
      "paths": [
        ".env.example",
        ".gitignore",
        "AGENTS.md",
        "README.md",
        "config/account-ramp-profile.example.json",
        "config/account-ramp-profile.schema.json",
        "config/hermes-capability-acceptance.example.json",
        "config/input-methods.example.psd1",
        "config/matrix.example.psd1",
        "config/research-result.schema.json",
        "config/research-task.example.json",
        "config/research-task.schema.json",
        "config/xhs-page-rules.json",
        "docs/ACCOUNT_RAMP_UP_AUTOMATION.md",
        "docs/ARCHITECTURE.md",
        "docs/FEED_RUNBOOK.md",
        "docs/FEED_WORKFLOW.md",
        "docs/INPUT_METHOD_WORKFLOW.md",
        "docs/MACHINE_IDENTITY.md",
        "docs/MAC_REMOTE_ACCESS_HANDOFF.md",
        "docs/RESEARCH_AUTOMATION.md",
        "docs/SAFETY.md",
        "docs/TAILSCALE_REMOTE_CONTROL.md",
        "docs/XIAOWEI_MATRIX.md",
        "docs/trusted-runs/FEED_TRUSTED_10_20260714.md",
        "package-lock.json",
        "package.json",
        "prompts/comment-draft.txt",
        "prompts/research-analyst.txt",
        "prompts/topic-planner.txt",
        "prompts/xhs-page-classifier.txt",
        "scripts/Capture-VisibleWindow.ps1",
        "scripts/Collect-PhoneAssets.ps1",
        "scripts/Device-Lock.ps1",
        "scripts/Get-WindowsCaptureCompatibility.ps1",
        "scripts/Import-Utf8PowerShellDataFile.ps1",
        "scripts/Install-TailscaleOpenSsh.ps1",
        "scripts/Invoke-MatrixAction.ps1",
        "scripts/Invoke-XhsOverTailscale.ps1",
        "scripts/Lark-InventoryPolicy.ps1",
        "scripts/Machine-Identity.ps1",
        "scripts/Manage-XiaoweiHost.ps1",
        "scripts/Matrix-Preflight.ps1",
        "scripts/Open-AccountRampCandidate.ps1",
        "scripts/Open-ReviewCandidate.ps1",
        "scripts/Run-AccountRamp.ps1",
        "scripts/Run-FeedWorkflow.ps1",
        "scripts/Run-Pipeline.ps1",
        "scripts/Run-TopicResearch.ps1",
        "scripts/Sync-LarkBase.ps1",
        "scripts/Sync-ResearchReview.ps1",
        "scripts/Test-Project.ps1",
        "scripts/Test-TailscaleOpenSsh.ps1",
        "scripts/account-ramp.mjs",
        "scripts/adb-research-provider.mjs",
        "scripts/ai-role-runner.mjs",
        "scripts/cloud-vision.mjs",
        "scripts/feed-device-runner.mjs",
        "scripts/feed-workflow.mjs",
        "scripts/greenarrow-api.mjs",
        "scripts/local-ocr.mjs",